dotnet,roslyn,10306,gafter,2.0 (RC),[Bug] Redundant "Remove Unnecessary Cast" with pattern-matching,True,0 - Backlog#Area-Compilers#Blocked#Bug#Language-C##New Language Feature - Pattern Matching,https://api.github.com/repos/dotnet/roslyn/issues/10306
dotnet,roslyn,9581,gafter,2.0 (RC),A missing definite assignment error for a 'using' local.,True,0 - Backlog#Area-Compilers#Bug#Language-C#,https://api.github.com/repos/dotnet/roslyn/issues/9581
dotnet,roslyn,9542,gafter,2.0 (RC),Test code coverage of pattern-matching implementation.,True,0 - Backlog#Area-Compilers#Bug#Language-C##New Language Feature - Pattern Matching,https://api.github.com/repos/dotnet/roslyn/issues/9542
dotnet,roslyn,9520,VSadov,2.0 (RC),Difference in lambda construction/evaluation depending on subsequent usages,True,Area-Compilers#Investigating,https://api.github.com/repos/dotnet/roslyn/issues/9520
dotnet,roslyn,9313,AlekseyTs,2.0 (RC),VB enum matching issues,True,Area-Compilers#Question,https://api.github.com/repos/dotnet/roslyn/issues/9313
dotnet,roslyn,9303,VSadov,2.0 (RC),add tests for ?. and generic receivers,True,Area-Compilers#Language-C##Test,https://api.github.com/repos/dotnet/roslyn/issues/9303
dotnet,roslyn,8999,agocke,2.0 (RC),Added code with C# 6 syntax to AllInOne in TestResource.resx. ,True,Area-Compilers#cla-signed#Community,https://api.github.com/repos/dotnet/roslyn/issues/8999
dotnet,roslyn,8984,agocke,2.0 (RC),AllInOne file does not cover C# 6.0 featuries,True,4 - In Review#Area-Compilers#Community#Test,https://api.github.com/repos/dotnet/roslyn/issues/8984
dotnet,roslyn,8951,agocke,2.0 (RC),Csc.dll should be moved from x64 -> AnyCPU,True,Area-Compilers#Feature Request,https://api.github.com/repos/dotnet/roslyn/issues/8951
dotnet,roslyn,8489,VSadov,2.0 (RC),WPF databinding ref-returning properties fails. Should ref-returning members be invokable via reflection?,True,Area-Compilers#New Language Feature - Ref Locals and Returns#Question,https://api.github.com/repos/dotnet/roslyn/issues/8489
dotnet,roslyn,8354,gafter,2.0 (RC),CSharpParseOptions has no public constructor that takes feature flags,True,0 - Backlog#Area-Compilers#Bug#Concept-API,https://api.github.com/repos/dotnet/roslyn/issues/8354
dotnet,roslyn,7588,gafter,2.0 (RC),add `csc /version`,True,Area-Compilers#Feature Request,https://api.github.com/repos/dotnet/roslyn/issues/7588
dotnet,roslyn,7398,gafter,2.0 (RC),OOM during constant string folding due to allocations from ConstantStringValue,True,0 - Backlog#Area-Compilers#Bug#Tenet-Reliability,https://api.github.com/repos/dotnet/roslyn/issues/7398
dotnet,roslyn,7282,gafter,2.0 (RC),Expose IMethodSymbol.ImplementationAttributes,True,Area-Compilers#Concept-API#Feature Request,https://api.github.com/repos/dotnet/roslyn/issues/7282
dotnet,roslyn,6967,gafter,2.0 (RC),SemanticModel AnalyzeDataFlow returning "wrong" results,True,0 - Backlog#Area-Compilers#Bug#Concept-API,https://api.github.com/repos/dotnet/roslyn/issues/6967
dotnet,roslyn,4716,gafter,2.0 (RC),Update compiler spec and/or language spec for switch expression conversions,True,0 - Backlog#Area-Compilers#Documentation,https://api.github.com/repos/dotnet/roslyn/issues/4716
dotnet,roslyn,13373,none,2.0 (RTM),[VB tuples] types differing only in custom modifiers should be Identity convertable,True,Area-Compilers#Bug#Language-VB#New Language Feature - Tuples,https://api.github.com/repos/dotnet/roslyn/issues/13373
dotnet,roslyn,13312,none,2.0 (RTM),Additional tests for pattern matching inference interaction with other language features,True,Area-Compilers#New Language Feature - Pattern Matching#Test,https://api.github.com/repos/dotnet/roslyn/issues/13312
dotnet,roslyn,13261,heejaechang,2.0 (RTM),clean up IDiagnosticAnalyzerService,True,Area-Analyzers#Bug,https://api.github.com/repos/dotnet/roslyn/issues/13261
dotnet,roslyn,13252,none,2.0 (RTM),"Extract Method" crashes in presence of expression declarations (out var  patterns),True,Area-Compilers#Area-IDE#Bug#New Language Feature - Out Variable Declaration#New Language Feature - Pattern Matching,https://api.github.com/repos/dotnet/roslyn/issues/13252
dotnet,roslyn,13200,AlekseyTs,2.0 (RTM),References to generic types when linking/embedding should fail compilation,True,Area-Compilers#Bug#Language-C##Language-VB,https://api.github.com/repos/dotnet/roslyn/issues/13200
dotnet,roslyn,13196,none,2.0 (RTM),See if we can change type of the Binder.ScopeDesignator to CSharpSyntaxNode ,True,Area-Compilers#Language-C#,https://api.github.com/repos/dotnet/roslyn/issues/13196
dotnet,roslyn,13146,jaredpar,2.0 (RTM),Could not load file or assembly 'System.Reflection.Metadata',True,Area-Compilers#Need More Info,https://api.github.com/repos/dotnet/roslyn/issues/13146
dotnet,roslyn,12966,none,2.0 (RTM),VB Tuples: semantic model for VB,True,Area-Compilers#Bug#Language-VB#New Language Feature - Tuples,https://api.github.com/repos/dotnet/roslyn/issues/12966
dotnet,roslyn,12965,none,2.0 (RTM),VB Tuples: support for partially named tuples,True,Area-Compilers#Bug#Language-VB#New Language Feature - Tuples,https://api.github.com/repos/dotnet/roslyn/issues/12965
dotnet,roslyn,12964,none,2.0 (RTM),VB Tuples: name match/mismatch rules similar,True,Area-Compilers#Bug#Language-VB#New Language Feature - Tuples,https://api.github.com/repos/dotnet/roslyn/issues/12964
dotnet,roslyn,12963,none,2.0 (RTM),VB Tuples: support metadata export import for tuple names,True,Area-Compilers#Bug#Language-VB#New Language Feature - Tuples,https://api.github.com/repos/dotnet/roslyn/issues/12963
dotnet,roslyn,12940,AlekseyTs,2.0 (RTM),Missing bound node for out variable declaration,True,Area-Compilers#Bug#New Language Feature - Out Variable Declaration,https://api.github.com/repos/dotnet/roslyn/issues/12940
dotnet,roslyn,12926,none,2.0 (RTM),Checksum computation over stream wraps IOExceptions in TargetInvocationException,True,Area-Compilers#Bug#Concept-API,https://api.github.com/repos/dotnet/roslyn/issues/12926
dotnet,roslyn,12905,none,2.0 (RTM),In deconstruction declaration `var (x  y  z) = e;`  we bind `var` three times.,True,Area-Compilers#Bug#New Language Feature - Tuples,https://api.github.com/repos/dotnet/roslyn/issues/12905
dotnet,roslyn,12901,CyrusNajmabadi,2.0 (RTM),Add tests for SuggestionTag,True,Area-IDE#Concept-Continuous Improvement#Test,https://api.github.com/repos/dotnet/roslyn/issues/12901
dotnet,roslyn,12838,none,2.0 (RTM),Test asserts temporary variable that can be inlined cannot be inlined,True,Area-Compilers#Area-IDE#Bug#Test,https://api.github.com/repos/dotnet/roslyn/issues/12838
dotnet,roslyn,12822,none,2.0 (RTM),Signing issue with huge key,True,Area-Compilers#Feature Request#Tenet-Compatibility,https://api.github.com/repos/dotnet/roslyn/issues/12822
dotnet,roslyn,12797,none,2.0 (RTM),C# 7.0 tuples - Invalid code generation for expression trees,True,Area-Compilers#Bug,https://api.github.com/repos/dotnet/roslyn/issues/12797
dotnet,roslyn,12764,none,2.0 (RTM),The TestImpact switch needs tests for the command line and MSBuild task+targets,True,Area-Interactive#Bug,https://api.github.com/repos/dotnet/roslyn/issues/12764
dotnet,roslyn,12696,none,2.0 (RTM),nameof operator has some inconsistant behavior with fixed size buffers and static inner classes and can crash,True,Area-Compilers#Bug,https://api.github.com/repos/dotnet/roslyn/issues/12696
dotnet,roslyn,12682,DustinCampbell,2.0 (RTM),Inline Temp breaks formatting in certain cases,True,Area-IDE#Bug,https://api.github.com/repos/dotnet/roslyn/issues/12682
dotnet,roslyn,12677,agocke,2.0 (RTM),Clean up GetAttributes in Cci.IReference/Cci.IDefinition,True,Area-Compilers,https://api.github.com/repos/dotnet/roslyn/issues/12677
dotnet,roslyn,12653,tmat,2.0 (RTM),Missing diagnostic when compiling against bad metadata (where we detect the badness),True,Area-Compilers#Bug,https://api.github.com/repos/dotnet/roslyn/issues/12653
dotnet,roslyn,12633,KevinH-MS,2.0 (RTM),Non-fatal watson when stopping in a CLR v2 dynamic method,True,Area-Interactive,https://api.github.com/repos/dotnet/roslyn/issues/12633
dotnet,roslyn,12564,none,2.0 (RTM),Wrong sequence points generated for if in async void method,True,Area-Compilers#Bug#Interactive-Debugging,https://api.github.com/repos/dotnet/roslyn/issues/12564
dotnet,roslyn,12550,agocke,2.0 (RTM),ReportErrors is not thread safe but can be invoked concurrently with /parallel,True,Area-Compilers#Bug,https://api.github.com/repos/dotnet/roslyn/issues/12550
dotnet,roslyn,12467,none,2.0 (RTM),Squiggles are on the wrong span for out parameter unassigned error,True,Area-Compilers#Bug#New Language Feature - Local Functions#New Language Feature - Out Variable Declaration,https://api.github.com/repos/dotnet/roslyn/issues/12467
dotnet,roslyn,12446,none,2.0 (RTM),TestResource.AllInOneCSharpCode is missing VariableDeconstructionDeclarator,True,Area-Compilers#Bug#New Language Feature - Tuples#Test,https://api.github.com/repos/dotnet/roslyn/issues/12446
dotnet,roslyn,12420,none,2.0 (RTM),CSharpCompilation.AddSyntaxTree iterates trees multiple times,True,Area-Compilers#Bug#Tenet-Performance,https://api.github.com/repos/dotnet/roslyn/issues/12420
dotnet,roslyn,12399,jcouv,2.0 (RTM),Optimize the parsing ahead for deconstruction-declarations to avoid allocations,True,Area-Compilers#Feature Request#New Language Feature - Tuples#Tenet-Performance,https://api.github.com/repos/dotnet/roslyn/issues/12399
dotnet,roslyn,12398,jcouv,2.0 (RTM),Verify the behavior of dynamic in deconstructions,True,Area-Compilers#New Language Feature - Tuples,https://api.github.com/repos/dotnet/roslyn/issues/12398
dotnet,roslyn,12393,none,2.0 (RTM),error CS0518: Predefined type 'System.Object' is not defined or imported,True,Area-Compilers#Concept-Portability#Question,https://api.github.com/repos/dotnet/roslyn/issues/12393
dotnet,roslyn,12360,jaredpar,2.0 (RTM),Build using Microsoft.Net.Compilers is 3 times slower than without it,True,Area-Compilers#Area-Performance#Blocked#Bug,https://api.github.com/repos/dotnet/roslyn/issues/12360
dotnet,roslyn,12354,none,2.0 (RTM),Extra " (or \?) in VisualBasicCommandLineParser.FindFileInSdkPath  causing Sdk file not found,True,Area-Compilers#Bug#Language-VB,https://api.github.com/repos/dotnet/roslyn/issues/12354
dotnet,roslyn,12348,none,2.0 (RTM),EncodedStringText.Decode does not handle memory stream with non-zero offset correctly,True,Area-Compilers#Bug,https://api.github.com/repos/dotnet/roslyn/issues/12348
dotnet,roslyn,12345,jcouv,2.0 (RTM),VS2015-Update3: Struct implicit conversion with binary operators,True,Area-Compilers#Bug#Tenet-Compatibility,https://api.github.com/repos/dotnet/roslyn/issues/12345
dotnet,roslyn,12315,Pilchie,2.0 (RTM),Autoformatting: nested if-else indentation,True,Area-IDE#Bug,https://api.github.com/repos/dotnet/roslyn/issues/12315
dotnet,roslyn,12313,none,2.0 (RTM),Rationalize IEquatable implementation in Microsoft.CodeAnalysis.CSharp.Conversion,True,Area-Compilers#Bug#Language-C##New Language Feature - Tuples,https://api.github.com/repos/dotnet/roslyn/issues/12313
dotnet,roslyn,12297,none,2.0 (RTM),Roslyn compiler emits different code for NewExpression for anonymous type with no members,True,Area-Compilers#Bug#Tenet-Compatibility,https://api.github.com/repos/dotnet/roslyn/issues/12297
dotnet,roslyn,12285,none,2.0 (RTM),Peverify needs to be updated for new ref-locals/returns rules,True,Area-Compilers#Language-C##New Language Feature - Ref Locals and Returns,https://api.github.com/repos/dotnet/roslyn/issues/12285
dotnet,roslyn,12283,VSadov,2.0 (RTM),Field assigned via ref return warns about being un-assigned,True,Area-Compilers#Bug#New Language Feature - Ref Locals and Returns,https://api.github.com/repos/dotnet/roslyn/issues/12283
dotnet,roslyn,12236,none,2.0 (RTM),[Flaky test] AV in SyntaxAnnotationTests.TestCSharpAllInOneRandom,True,Area-Compilers#Bug#Contributor Pain#Flaky#Investigation Required#Test,https://api.github.com/repos/dotnet/roslyn/issues/12236
dotnet,roslyn,12225,AlekseyTs,2.0 (RTM),WRN_UnreferencedVarAssg "The variable '...' is assigned but its value is never used" is not reported for out variables,True,Area-Compilers#Bug#Language-C##New Language Feature - Out Variable Declaration,https://api.github.com/repos/dotnet/roslyn/issues/12225
dotnet,roslyn,12182,AlekseyTs,2.0 (RTM),Generate constructor code fix is not offered when Out Variable Declarations feature is not available,True,Area-Compilers#Language-C##New Language Feature - Out Variable Declaration,https://api.github.com/repos/dotnet/roslyn/issues/12182
dotnet,roslyn,12135,none,2.0 (RTM),[Test Failure] No identified problem in windows_debug_unit64_prtest on PR #12110#issuecomment-227490762,True,Area-Compilers#Bug,https://api.github.com/repos/dotnet/roslyn/issues/12135
dotnet,roslyn,12124,AlekseyTs,2.0 (RTM),Change Signature refactoring allows to delete parameter targeted by an Out Variable Declaration  resulting in an invalid code,True,Area-Compilers#Bug#Language-C##New Language Feature - Out Variable Declaration,https://api.github.com/repos/dotnet/roslyn/issues/12124
dotnet,roslyn,12123,AlekseyTs,2.0 (RTM),Introduce Local refactoring produces an invalid code when Out Variable Declarations are involved.,True,Area-Compilers#Bug#Language-C##New Language Feature - Out Variable Declaration,https://api.github.com/repos/dotnet/roslyn/issues/12123
dotnet,roslyn,12122,AlekseyTs,2.0 (RTM),Extract method refactoring produces an invalid code when Out Variable Declarations are involved,True,Area-Compilers#Bug#Language-C##New Language Feature - Out Variable Declaration,https://api.github.com/repos/dotnet/roslyn/issues/12122
dotnet,roslyn,12112,rchande,2.0 (RTM),Remove optional params from AbstractSyntacticSingleKeywordRecommender ctor,True,Area-IDE#Bug#Concept-Continuous Improvement,https://api.github.com/repos/dotnet/roslyn/issues/12112
dotnet,roslyn,12111,rchande,2.0 (RTM),Move target type preselection command handler tests to provider tests,True,Area-IDE#Concept-Continuous Improvement#Test,https://api.github.com/repos/dotnet/roslyn/issues/12111
dotnet,roslyn,12101,jasonmalinowski,2.0 (RTM),Project.WithProjectReferences and friends allows you to give duplicate references,True,Area-IDE#Bug#Concept-Continuous Improvement,https://api.github.com/repos/dotnet/roslyn/issues/12101
dotnet,roslyn,12078,AlekseyTs,2.0 (RTM),Port Scope_Query_05 ... Scope_Query_10 and Query_01 unit-tests for Out Variable Declarations to pattern-matching,True,3 - Working#Area-Compilers#Language-C##New Language Feature - Pattern Matching#Test,https://api.github.com/repos/dotnet/roslyn/issues/12078
dotnet,roslyn,12058,AlekseyTs,2.0 (RTM),Spurious errors in out var error scenarios,True,Area-Compilers#Bug#New Language Feature - Out Variable Declaration,https://api.github.com/repos/dotnet/roslyn/issues/12058
dotnet,roslyn,12053,AlekseyTs,2.0 (RTM),No error is reported when a lambda parameter is shadowing a range variable ,True,Area-Compilers#Bug#Language-C#,https://api.github.com/repos/dotnet/roslyn/issues/12053
dotnet,roslyn,12052,AlekseyTs,2.0 (RTM),A misleading error is reported for a local or parameter conflicting with a range variable from an outer scope,True,Area-Compilers#Bug#Language-C#,https://api.github.com/repos/dotnet/roslyn/issues/12052
dotnet,roslyn,12045,none,2.0 (RTM),[.NET Core] Cannot compile when operations on dynamic types are performed,True,Area-Compilers#Bug#Concept-Portability,https://api.github.com/repos/dotnet/roslyn/issues/12045
dotnet,roslyn,11986,none,2.0 (RTM),Tuple implementation rejects implicit operators,True,Area-Compilers#Bug#New Language Feature - Tuples,https://api.github.com/repos/dotnet/roslyn/issues/11986
dotnet,roslyn,11933,none,2.0 (RTM),Cannot get type of implicitly typed array in VB.NET,True,Area-Compilers#Bug#Concept-API#Language-VB,https://api.github.com/repos/dotnet/roslyn/issues/11933
dotnet,roslyn,11925,none,2.0 (RTM),XML Literals attribute names.,True,Area-Compilers#Bug#Test,https://api.github.com/repos/dotnet/roslyn/issues/11925
dotnet,roslyn,11895,heejaechang,2.0 (RTM),move AI telemetry to use new data model AI API,True,Area-IDE#Feature Request#Tenet-Telemetry,https://api.github.com/repos/dotnet/roslyn/issues/11895
dotnet,roslyn,11871,none,2.0 (RTM),Add tests for ReduceExtensionMethod API with tuple types,True,Area-Compilers#Bug#Language-C##New Language Feature - Tuples,https://api.github.com/repos/dotnet/roslyn/issues/11871
dotnet,roslyn,11865,none,2.0 (RTM),Review implementation of CollectTupleElementFields ,True,Area-Compilers#Bug#Language-C##New Language Feature - Tuples,https://api.github.com/repos/dotnet/roslyn/issues/11865
dotnet,roslyn,11805,none,2.0 (RTM),Do we have to support tuple underlying types in semantic analysis?,True,Area-Compilers#Bug#Language-C##New Language Feature - Tuples,https://api.github.com/repos/dotnet/roslyn/issues/11805
dotnet,roslyn,11764,none,2.0 (RTM),CS7013,True,Area-Compilers#Bug#Tenet-Compatibility,https://api.github.com/repos/dotnet/roslyn/issues/11764
dotnet,roslyn,11699,tannergooding,2.0 (RTM),Incorrect Instance Count after debugging in BasicDebuggerIntellisense,True,Area-Interactive#Bug#Interactive-Debugging#Test#Urgency-Now,https://api.github.com/repos/dotnet/roslyn/issues/11699
dotnet,roslyn,11691,TyOverby,2.0 (RTM),ObsoleteAttribute prevents correct override checks,True,Area-Compilers#Bug,https://api.github.com/repos/dotnet/roslyn/issues/11691
dotnet,roslyn,11607,none,2.0 (RTM),CS0311 (cannot be used as type parameter) at wrong location,True,Area-Compilers#Bug#Concept-Diagnostic Clarity,https://api.github.com/repos/dotnet/roslyn/issues/11607
dotnet,roslyn,11566,AlekseyTs,2.0 (RTM),"Out Variable Declaration" work items and open design issues,True,Area-Compilers#Language-C##New Language Feature - Out Variable Declaration,https://api.github.com/repos/dotnet/roslyn/issues/11566
dotnet,roslyn,11538,jcouv,2.0 (RTM),Handle CSharp design rule suppressions in future,True,Area-Compilers#Bug#Language-C##New Language Feature - Tuples#Urgency-Soon,https://api.github.com/repos/dotnet/roslyn/issues/11538
dotnet,roslyn,11533,none,2.0 (RTM),Tuple implementation rejects tuple d-assignment from this,True,Area-Compilers#Bug#New Language Feature - Tuples,https://api.github.com/repos/dotnet/roslyn/issues/11533
dotnet,roslyn,11530,none,2.0 (RTM),Tuple implementation rejects implicit operators,True,Area-Compilers#Bug#New Language Feature - Tuples,https://api.github.com/repos/dotnet/roslyn/issues/11530
dotnet,roslyn,11486,none,2.0 (RTM),Not allowed to resolve a type with an XML tag  until it fully closed,True,Area-Compilers#Bug,https://api.github.com/repos/dotnet/roslyn/issues/11486
dotnet,roslyn,11456,VSadov,2.0 (RTM),Crash after starting WebDeploy,True,Area-Compilers#Bug,https://api.github.com/repos/dotnet/roslyn/issues/11456
dotnet,roslyn,11428,none,2.0 (RTM),CS7091/BC37207 (CmdOptionConflictsSource) report the internal option name  not the command-line flag,True,Area-Compilers#Bug,https://api.github.com/repos/dotnet/roslyn/issues/11428
dotnet,roslyn,11427,none,2.0 (RTM),Visual Basic only reports BC37207 (conflicting attribute/option for signing) for netmodules,True,Area-Compilers#Bug,https://api.github.com/repos/dotnet/roslyn/issues/11427
dotnet,roslyn,11408,CyrusNajmabadi,2.0 (RTM),Remove unnecessary code out of RoslynPackage,True,Area-IDE#Bug#Concept-Continuous Improvement,https://api.github.com/repos/dotnet/roslyn/issues/11408
dotnet,roslyn,11356,none,2.0 (RTM),Add another flag to visualizer  separate from IncludeParamsRefOut to control ref returns,True,Area-Compilers#Bug#Language-C##New Language Feature - Ref Locals and Returns,https://api.github.com/repos/dotnet/roslyn/issues/11356
dotnet,roslyn,11326,none,2.0 (RTM),Behavior of SemanticModel.GetTypeInfo API for tuple literals is inconsistent with behavior for other literals,True,Area-Compilers#Bug#Language-C##New Language Feature - Tuples,https://api.github.com/repos/dotnet/roslyn/issues/11326
dotnet,roslyn,11325,VSadov,2.0 (RTM),Conversions between instances of tuple types backed by different VT definitions should be supported.,True,Area-Compilers#Bug#Language-C##New Language Feature - Tuples,https://api.github.com/repos/dotnet/roslyn/issues/11325
dotnet,roslyn,11278,jaredpar,2.0 (RTM),Microsoft.CodeAnalysis.VisualBasic.UnitTests.MyTemplateTests.MyWinformApp sporatically failing,True,Area-Compilers#Bug#Flaky#Urgency-Soon,https://api.github.com/repos/dotnet/roslyn/issues/11278
dotnet,roslyn,11258,none,2.0 (RTM),Accessors of readonly/writeonly properties are marked as ImplicitlyDeclared for VB  causing no analyzer callbacks for these symbols,True,Area-Compilers#Bug,https://api.github.com/repos/dotnet/roslyn/issues/11258
dotnet,roslyn,11196,none,2.0 (RTM),Extract Method refactoring should refactor tuples even without System.ValueTuple type,True,Area-Compilers#Bug#New Language Feature - Tuples,https://api.github.com/repos/dotnet/roslyn/issues/11196
dotnet,roslyn,11154,jcouv,2.0 (RTM),Use Implicit Type refactoring should detect type as apparent in declaration for ValueTuple,True,Area-Compilers#Bug#New Language Feature - Tuples,https://api.github.com/repos/dotnet/roslyn/issues/11154
dotnet,roslyn,11095,jcouv,2.0 (RTM),Use Implicit Type refactoring incorrect for assigning ValueTuple.Create into tuple,True,Area-Compilers#Bug#New Language Feature - Tuples,https://api.github.com/repos/dotnet/roslyn/issues/11095
dotnet,roslyn,11094,balajikris,2.0 (RTM),Use Implicit Type refactoring to detect if type is apparent in declaration for tuples,True,Area-IDE#Bug#New Language Feature - Tuples,https://api.github.com/repos/dotnet/roslyn/issues/11094
dotnet,roslyn,11084,none,2.0 (RTM),IntelliSense complaining about not being able to find a type at assignment to "var",True,Area-Compilers#Bug#Concept-Diagnostic Clarity,https://api.github.com/repos/dotnet/roslyn/issues/11084
dotnet,roslyn,11062,none,2.0 (RTM),NullReferenceException in CSharp.InMethodBinder..ctor via CSharpSemanticModel.GetSymbolInfoCore,True,Area-Compilers#Bug,https://api.github.com/repos/dotnet/roslyn/issues/11062
dotnet,roslyn,11028,kuhlenh,2.0 (RTM),Simplify Inline Temporary refactoring for tuples,True,Area-IDE#New Language Feature - Tuples,https://api.github.com/repos/dotnet/roslyn/issues/11028
dotnet,roslyn,11021,kuhlenh,2.0 (RTM),Proposal: Tuple and Change Signature refactoring,True,Area-IDE#New Language Feature - Tuples,https://api.github.com/repos/dotnet/roslyn/issues/11021
dotnet,roslyn,11011,agocke,2.0 (RTM),Add an "AdditionalArguments" option to the Csc/Vbc build task,True,Area-Compilers#Feature Request,https://api.github.com/repos/dotnet/roslyn/issues/11011
dotnet,roslyn,11009,none,2.0 (RTM),System.NullReferenceException at SyntaxNode.get_EndPosition via CSharpSemanticModel.GetSymbolInfoCore,True,Area-Compilers#Bug#Concept-API,https://api.github.com/repos/dotnet/roslyn/issues/11009
dotnet,roslyn,10956,jaredpar,2.0 (RTM),Roslyn stack overflows on fluent method chain of length 1 000,True,Area-Compilers#Bug,https://api.github.com/repos/dotnet/roslyn/issues/10956
dotnet,roslyn,10940,none,2.0 (RTM),Weird Parser Error Recovery,True,Area-Compilers#Bug#Concept-Diagnostic Clarity,https://api.github.com/repos/dotnet/roslyn/issues/10940
dotnet,roslyn,10929,none,2.0 (RTM),VisualBasic With statement's expression variable sometimes doesn't get renamed,True,Area-Compilers#Bug,https://api.github.com/repos/dotnet/roslyn/issues/10929
dotnet,roslyn,10880,VSadov,2.0 (RTM),AV in PENamedTypeSymbol.MightContainExtensionMethods,True,Area-Compilers#Blocked#Bug,https://api.github.com/repos/dotnet/roslyn/issues/10880
dotnet,roslyn,10874,VSadov,2.0 (RTM),Consider whether missing member lookup on tuple should complain about tuple type or the underlying.,True,Area-Compilers#Bug#Language-C##New Language Feature - Tuples,https://api.github.com/repos/dotnet/roslyn/issues/10874
dotnet,roslyn,10858,none,2.0 (RTM),Enumerate files deterministically when compiling *.cs or *.vb,True,Area-Compilers#Bug#Concept-Determinism,https://api.github.com/repos/dotnet/roslyn/issues/10858
dotnet,roslyn,10853,none,2.0 (RTM),Add spec quotes in the method type inference code when spec is settled,True,Area-Compilers#Bug#Language-C##New Language Feature - Tuples,https://api.github.com/repos/dotnet/roslyn/issues/10853
dotnet,roslyn,10852,VSadov,2.0 (RTM),Make sure that tuple conversions are well speced and implementation matches the spec.,True,Area-Compilers#Bug#Language-C##New Language Feature - Tuples,https://api.github.com/repos/dotnet/roslyn/issues/10852
dotnet,roslyn,10843,none,2.0 (RTM),C#: TypeSymbolExtensions.IsExpressionTree uses some questionable logic,True,Area-Compilers#Bug#Language-C#,https://api.github.com/repos/dotnet/roslyn/issues/10843
dotnet,roslyn,10839,AnthonyDGreen,2.0 (RTM),VB nameof called with an byref param inside of a lambda fails.,True,Area-Compilers#Bug,https://api.github.com/repos/dotnet/roslyn/issues/10839
dotnet,roslyn,10822,none,2.0 (RTM),C#: SubstitutedMethodSymbol does not override GetReturnTypeAttributes method,True,Area-Compilers#Bug,https://api.github.com/repos/dotnet/roslyn/issues/10822
dotnet,roslyn,10820,none,2.0 (RTM),C#: RetargetingEventSymbol.GetAttributes doesn't retarget attributes applied to the underlying event,True,Area-Compilers#Bug,https://api.github.com/repos/dotnet/roslyn/issues/10820
dotnet,roslyn,10811,none,2.0 (RTM),Message for BC30560 should include what assemblies the ambiguous types come from,True,Area-Compilers#Bug#Concept-Diagnostic Clarity,https://api.github.com/repos/dotnet/roslyn/issues/10811
dotnet,roslyn,10803,jcouv,2.0 (RTM),TupleTypeSymbol/TupleFieldSymbol need to implement right behavior for ObsoleteAttributeData,True,Area-Compilers#Bug#New Language Feature - Tuples,https://api.github.com/repos/dotnet/roslyn/issues/10803
dotnet,roslyn,10765,agocke,2.0 (RTM),Investigate local functions with __arglist,True,Area-Compilers#Bug#New Language Feature - Local Functions,https://api.github.com/repos/dotnet/roslyn/issues/10765
