dotnet,roslyn,6937,jasonmalinowski,2.0 (Preview 5),Make the Workspaces integration tests not use the wrong product binaries in non-VS hosts,True,Area-IDE#Bug,https://api.github.com/repos/dotnet/roslyn/issues/6937
dotnet,roslyn,6917,none,2.0 (Preview 5),These is significant pause before the squiggles in interactive window goes away.,True,Area-Interactive#Interactive-ScriptingIDE,https://api.github.com/repos/dotnet/roslyn/issues/6917
dotnet,roslyn,6909,dpoeschl,2.0 (Preview 5),Roslyn shows Shared file in Miscellaneous Files project if its name matches one in head project,True,Area-IDE#Bug#Up for Grabs,https://api.github.com/repos/dotnet/roslyn/issues/6909
dotnet,roslyn,6904,tmat,2.0 (Preview 5),Ship metadata writer package,True,Area-Interactive,https://api.github.com/repos/dotnet/roslyn/issues/6904
dotnet,roslyn,6901,tmat,2.0 (Preview 5),EnC and debugging support for new language features,True,Area-Interactive,https://api.github.com/repos/dotnet/roslyn/issues/6901
dotnet,roslyn,6900,tmat,2.0 (Preview 5),Add NuGet support in scripting APIs,True,Area-Interactive,https://api.github.com/repos/dotnet/roslyn/issues/6900
dotnet,roslyn,6898,drognanar,2.0 (Preview 5),Finish work to bring up vbi,True,Area-Interactive,https://api.github.com/repos/dotnet/roslyn/issues/6898
dotnet,roslyn,6897,tmat,2.0 (Preview 5),Finish work on VB scripting APIs,True,Area-Interactive,https://api.github.com/repos/dotnet/roslyn/issues/6897
dotnet,roslyn,6896,JohnHamby,2.0 (Preview 5),Finish work on VB Interactive window,True,Area-Interactive,https://api.github.com/repos/dotnet/roslyn/issues/6896
dotnet,roslyn,6893,KevinH-MS,2.0 (Preview 5),Improve start up perf for running scripts,True,Area-Interactive,https://api.github.com/repos/dotnet/roslyn/issues/6893
dotnet,roslyn,6885,genlu,2.0 (Preview 5),Adding indentations in csi,True,Area-Interactive,https://api.github.com/repos/dotnet/roslyn/issues/6885
dotnet,roslyn,6883,genlu,2.0 (Preview 5),Colorize keywords in csi,True,Area-Interactive,https://api.github.com/repos/dotnet/roslyn/issues/6883
dotnet,roslyn,6882,tannergooding,2.0 (Preview 5),integrate csi with dotnet cli and test it works or coreclr,True,Area-Interactive#Interactive-ScriptingLogic,https://api.github.com/repos/dotnet/roslyn/issues/6882
dotnet,roslyn,6881,tmat,2.0 (Preview 5),Symbol server support for new pdb format,True,Area-Interactive#Feature Request#Interactive-Debugging,https://api.github.com/repos/dotnet/roslyn/issues/6881
dotnet,roslyn,6880,tmat,2.0 (Preview 5),Write a converter from old to new pdb format ,True,Area-Interactive#Interactive-Debugging,https://api.github.com/repos/dotnet/roslyn/issues/6880
dotnet,roslyn,6846,heejaechang,2.0 (Preview 5),Move IDE diagnostic engine out of proc,True,Area-Analyzers#Story,https://api.github.com/repos/dotnet/roslyn/issues/6846
dotnet,roslyn,6826,DustinCampbell,2.0 (Preview 5),Info Bar shows the type name of a code fix or refactoring rather than the friendly name,True,Area-IDE#Bug,https://api.github.com/repos/dotnet/roslyn/issues/6826
dotnet,roslyn,6783,jmarolf,2.0 (Preview 5),Implement interface creates members in undesired way,True,Area-IDE,https://api.github.com/repos/dotnet/roslyn/issues/6783
dotnet,roslyn,6751,genlu,2.0 (Preview 5),Implement history navigation in csi,True,Area-Interactive#Interactive-ScriptingLogic,https://api.github.com/repos/dotnet/roslyn/issues/6751
dotnet,roslyn,6746,none,2.0 (Preview 5),Fix rename tracking in the interactive window,True,Area-Interactive#Bug#Interactive-ScriptingIDE,https://api.github.com/repos/dotnet/roslyn/issues/6746
dotnet,roslyn,6742,tmat,2.0 (Preview 5),Consider changing lookup of simple assembly names in #r,True,Area-Interactive#Interactive-ScriptingLogic,https://api.github.com/repos/dotnet/roslyn/issues/6742
dotnet,roslyn,6735,KevinH-MS,2.0 (Preview 5),EE: Evaluation of hoisted local uses wrong closure,True,Area-Interactive#Bug#Interactive-Debugging,https://api.github.com/repos/dotnet/roslyn/issues/6735
dotnet,roslyn,6715,drognanar,2.0 (Preview 5),Roslyn displays misleading error message when attempting to make an EnC edit,True,Area-Interactive#Interactive-Debugging,https://api.github.com/repos/dotnet/roslyn/issues/6715
dotnet,roslyn,6709,jasonmalinowski,2.0 (Preview 5),Opening solution containing projects with non-solution configurations.,True,Area-IDE#Concept-API,https://api.github.com/repos/dotnet/roslyn/issues/6709
dotnet,roslyn,6702,balajikris,2.0 (Preview 5),Unexpected result of Extract Method refactoring,True,Area-IDE#Bug,https://api.github.com/repos/dotnet/roslyn/issues/6702
dotnet,roslyn,6681,none,2.0 (Preview 5),Interactive: Signature help not classified,True,Area-Interactive#Bug#Interactive-ScriptingIDE,https://api.github.com/repos/dotnet/roslyn/issues/6681
dotnet,roslyn,6676,tmat,2.0 (Preview 5),Require semicolon after embedded statements,True,Area-Interactive#Bug#Interactive-ScriptingLogic,https://api.github.com/repos/dotnet/roslyn/issues/6676
dotnet,roslyn,6666,genlu,2.0 (Preview 5),Support standard input in the interactive window,True,Area-Interactive#Feature Request#Interactive-ScriptingIDE,https://api.github.com/repos/dotnet/roslyn/issues/6666
dotnet,roslyn,6663,none,2.0 (Preview 5),Make #help per-language,True,Area-Interactive#Bug#Interactive-ScriptingIDE,https://api.github.com/repos/dotnet/roslyn/issues/6663
dotnet,roslyn,6662,KevinH-MS,2.0 (Preview 5),#load completion is slow for network drives,True,Area-Interactive#Bug#Interactive-ScriptingIDE,https://api.github.com/repos/dotnet/roslyn/issues/6662
dotnet,roslyn,6649,heejaechang,2.0 (Preview 5),Diagnostic issues with locations in non-code files do not appear in VS's error list,True,Area-Analyzers#Bug,https://api.github.com/repos/dotnet/roslyn/issues/6649
dotnet,roslyn,6630,none,2.0 (Preview 5),Request: easier to switch between PCL and ClassLibrary,True,Area-IDE#Feature Request,https://api.github.com/repos/dotnet/roslyn/issues/6630
dotnet,roslyn,6621,none,2.0 (Preview 5),Peek is broken in interactive window,True,Area-Interactive#Bug#Interactive-ScriptingIDE,https://api.github.com/repos/dotnet/roslyn/issues/6621
dotnet,roslyn,6587,tmat,2.0 (Preview 5),Add Imports not offered after first submission,True,Area-Interactive#Bug#Interactive-ScriptingIDE,https://api.github.com/repos/dotnet/roslyn/issues/6587
dotnet,roslyn,6579,tmat,2.0 (Preview 5),Additional (unstable) dependencies in Microsoft.CodeAnalysis.Scripting RC1,True,Area-Interactive#Interactive-ScriptingIDE,https://api.github.com/repos/dotnet/roslyn/issues/6579
dotnet,roslyn,6576,KevinH-MS,2.0 (Preview 5),EE: Cannot assign to generic field,True,Area-Interactive#Bug#Interactive-Debugging,https://api.github.com/repos/dotnet/roslyn/issues/6576
dotnet,roslyn,6544,jasonmalinowski,2.0 (Preview 5),F12 GoToDefinition  when you're on a declaration  should go to the implementation,True,Area-IDE#Bug,https://api.github.com/repos/dotnet/roslyn/issues/6544
dotnet,roslyn,6535,mattwar,2.0 (Preview 5),Project platform settings other than "Any CPU" are ignored,True,Area-IDE#Feature Request,https://api.github.com/repos/dotnet/roslyn/issues/6535
dotnet,roslyn,6520,jmarolf,2.0 (Preview 5),Roslyn SDK VSIX intermittently fails to install,True,Area-Infrastructure#Contributor Pain,https://api.github.com/repos/dotnet/roslyn/issues/6520
dotnet,roslyn,6516,dpoeschl,2.0 (Preview 5),Clean up syntactic classification of non-RDT'd buffers,True,Area-IDE#Bug,https://api.github.com/repos/dotnet/roslyn/issues/6516
dotnet,roslyn,6492,tmat,2.0 (Preview 5),Add APIs for inspecting script references to ScriptContext class,True,Area-Interactive#Feature Request#Interactive-ScriptingLogic,https://api.github.com/repos/dotnet/roslyn/issues/6492
dotnet,roslyn,6483,tmat,2.0 (Preview 5),RuntimeMetadataReferenceResolver and InteractiveAssemblyLoader should look for .winmd,True,Area-Interactive#Interactive-ScriptingLogic,https://api.github.com/repos/dotnet/roslyn/issues/6483
dotnet,roslyn,6467,rchande,2.0 (Preview 5),When checking ASP.NET 5.0  you can't select Windows 8.1  Windows Phone 8.1 and .NET Framework 4.5.1,True,Area-IDE#Bug,https://api.github.com/repos/dotnet/roslyn/issues/6467
dotnet,roslyn,6465,tmat,2.0 (Preview 5),Revisit desktop script tests and make them cross-plat where possible,True,Area-Interactive#Interactive-ScriptingLogic#Test,https://api.github.com/repos/dotnet/roslyn/issues/6465
dotnet,roslyn,6456,tmat,2.0 (Preview 5),CommonReferenceManager.ResolveReferencedAssembly doesn't prefer higher version of unified assemblies,True,Area-Interactive#Bug#Interactive-ScriptingLogic,https://api.github.com/repos/dotnet/roslyn/issues/6456
dotnet,roslyn,6450,drognanar,2.0 (Preview 5),VB scripting: Implement VisualBasicCompilation.GetDirectiveReference,True,Area-Interactive#Interactive-ScriptingLogic,https://api.github.com/repos/dotnet/roslyn/issues/6450
dotnet,roslyn,6441,genlu,2.0 (Preview 5),Script directive help display for CSharp and VB is hard wired in Interactive Window,True,Area-Interactive#Interactive-ScriptingIDE,https://api.github.com/repos/dotnet/roslyn/issues/6441
dotnet,roslyn,6396,heejaechang,2.0 (Preview 5),Support 2 analyzer returning same error id for de-duplication,True,Area-Analyzers#Bug,https://api.github.com/repos/dotnet/roslyn/issues/6396
dotnet,roslyn,6385,none,2.0 (Preview 5),Don't suggest adding an alias to an extern alias that is not a valid identitifer,True,Area-Interactive#Bug#Interactive-ScriptingIDE,https://api.github.com/repos/dotnet/roslyn/issues/6385
dotnet,roslyn,6367,heejaechang,2.0 (Preview 5),IDiagnosticService needs cleanup,True,Area-Analyzers#Bug,https://api.github.com/repos/dotnet/roslyn/issues/6367
dotnet,roslyn,6333,KevinH-MS,2.0 (Preview 5),Interactive window slows down as number of inputs increases,True,Area-Interactive#Interactive-ScriptingIDE,https://api.github.com/repos/dotnet/roslyn/issues/6333
dotnet,roslyn,6322,jmarolf,2.0 (Preview 5),Analyzer installation script fails to add assemblies with different versions,True,Area-IDE#Bug,https://api.github.com/repos/dotnet/roslyn/issues/6322
dotnet,roslyn,6314,dpoeschl,2.0 (Preview 5),Rename reports conflict for methods differing only by 'out' or 'ref' parameters,True,Area-IDE#Bug,https://api.github.com/repos/dotnet/roslyn/issues/6314
dotnet,roslyn,6309,DustinCampbell,2.0 (Preview 5),Floating point casts are incorrectly reported as redundant,True,Area-IDE#Bug,https://api.github.com/repos/dotnet/roslyn/issues/6309
dotnet,roslyn,6287,none,2.0 (Preview 5),csi should perhaps look into directories specified /loadpaths for the given script,True,Area-Interactive#Interactive-ScriptingLogic,https://api.github.com/repos/dotnet/roslyn/issues/6287
dotnet,roslyn,6276,mattwar,2.0 (Preview 5),make CompilationTracker.Finalize in Workspace to create p2p reference that doesnt hold onto compilation strongly,True,Area-IDE#Feature Request#Tenet-Performance,https://api.github.com/repos/dotnet/roslyn/issues/6276
dotnet,roslyn,6261,mattwar,2.0 (Preview 5),Correct way to rename a file in a code fix,True,Area-IDE#Question,https://api.github.com/repos/dotnet/roslyn/issues/6261
dotnet,roslyn,6208,KevinH-MS,2.0 (Preview 5),Can't tell if script has a return value,True,Area-Interactive#Interactive-ScriptingLogic,https://api.github.com/repos/dotnet/roslyn/issues/6208
dotnet,roslyn,6183,AlekseyTs,2.0 (Preview 5),Proposal: out var declaration,True,3 - Working#Area-Language Design#Feature Request#Language-C##New Language Feature - Out Variable Declaration,https://api.github.com/repos/dotnet/roslyn/issues/6183
dotnet,roslyn,6179,tmat,2.0 (Preview 5),Enable GlobalAssemblyCacheTests.GetAssemblyIdentities test,True,Area-Interactive#Bug#Interactive-ScriptingLogic,https://api.github.com/repos/dotnet/roslyn/issues/6179
dotnet,roslyn,6121,dpoeschl,2.0 (Preview 5),The outline box of the inline rename is misleading,True,Area-IDE#Feature Request,https://api.github.com/repos/dotnet/roslyn/issues/6121
dotnet,roslyn,6107,KevinH-MS,2.0 (Preview 5),'.' typed in #r argument should trigger completion,True,Area-Interactive#Bug#Interactive-ScriptingIDE,https://api.github.com/repos/dotnet/roslyn/issues/6107
dotnet,roslyn,6106,genlu,2.0 (Preview 5),Implement paste special in Interactive Window,True,Area-Interactive#Feature Request#Interactive-ScriptingIDE,https://api.github.com/repos/dotnet/roslyn/issues/6106
dotnet,roslyn,6105,none,2.0 (Preview 5),Error text in InteractiveWindow is not properly colored,True,Area-Interactive#Bug#Interactive-ScriptingIDE,https://api.github.com/repos/dotnet/roslyn/issues/6105
dotnet,roslyn,6101,tmat,2.0 (Preview 5),Scripting API: metadata references not backed by a file don't load,True,Area-Interactive#Interactive-ScriptingLogic,https://api.github.com/repos/dotnet/roslyn/issues/6101
dotnet,roslyn,6094,tmat,2.0 (Preview 5),Script code should compile against a reference assembly and run against a runtime assembly,True,Area-Interactive#Interactive-ScriptingLogic,https://api.github.com/repos/dotnet/roslyn/issues/6094
dotnet,roslyn,6078,none,2.0 (Preview 5),Remove RoslynImageCatalogGuid,True,Area-Interactive#Bug#Interactive-ScriptingIDE,https://api.github.com/repos/dotnet/roslyn/issues/6078
dotnet,roslyn,6014,balajikris,2.0 (Preview 5),Codelens fails to populate reference count in a just added VB multiproject solution,True,Area-IDE#Bug,https://api.github.com/repos/dotnet/roslyn/issues/6014
dotnet,roslyn,5999,none,2.0 (Preview 5),Cannot add AdditionalFiles in custom targets file,True,Area-IDE#Feature Request,https://api.github.com/repos/dotnet/roslyn/issues/5999
dotnet,roslyn,5979,tmat,2.0 (Preview 5),Add Script property to InteractiveScriptGlobals that returns a ScriptEnvironment object,True,Area-Interactive#Interactive-ScriptingLogic,https://api.github.com/repos/dotnet/roslyn/issues/5979
dotnet,roslyn,5959,mattwar,2.0 (Preview 5),Only the name of the assembly should be added when copying metadata references,True,Area-IDE#Bug,https://api.github.com/repos/dotnet/roslyn/issues/5959
dotnet,roslyn,5950,none,2.0 (Preview 5),Unify implementation of DisplayDiagnostics between CLI and IW,True,Area-Interactive#Interactive-ScriptingIDE,https://api.github.com/repos/dotnet/roslyn/issues/5950
dotnet,roslyn,5949,tmat,2.0 (Preview 5),Scripting API: Avoid throwing and catching CompilationErrorException in Script.Build,True,Area-Interactive#Interactive-ScriptingLogic,https://api.github.com/repos/dotnet/roslyn/issues/5949
dotnet,roslyn,5944,none,2.0 (Preview 5),Make VB script compilation APIs public,True,Area-Interactive#Interactive-ScriptingLogic,https://api.github.com/repos/dotnet/roslyn/issues/5944
dotnet,roslyn,5943,KevinH-MS,2.0 (Preview 5),Debugger falsely shows struct parameter as uninitialized,True,Area-Interactive#Interactive-Debugging,https://api.github.com/repos/dotnet/roslyn/issues/5943
dotnet,roslyn,5923,tmat,2.0 (Preview 5),Call ResolveMissingAssembly for the same identity if the requestingReference differs,True,Area-Interactive#Interactive-ScriptingLogic,https://api.github.com/repos/dotnet/roslyn/issues/5923
dotnet,roslyn,5904,tmat,2.0 (Preview 5),CommandLine_ScriptRunner1 test case fails on Linux,True,Area-Interactive#Interactive-ScriptingLogic#Test,https://api.github.com/repos/dotnet/roslyn/issues/5904
dotnet,roslyn,5903,tmat,2.0 (Preview 5),Scripting test coverage: add more tests for ScriptReferenceResolver  ScriptSourceResolver,True,Area-Interactive#Interactive-ScriptingLogic#Test,https://api.github.com/repos/dotnet/roslyn/issues/5903
dotnet,roslyn,5898,jmarolf,2.0 (Preview 5),Visual Basic Auto-implement interface behaviour changed,True,Area-IDE,https://api.github.com/repos/dotnet/roslyn/issues/5898
dotnet,roslyn,5873,CyrusNajmabadi,2.0 (Preview 5),C# auto-formatter always changes tabs to spaces around comments,True,Area-IDE#Bug,https://api.github.com/repos/dotnet/roslyn/issues/5873
dotnet,roslyn,5858,none,2.0 (Preview 5),[C# Interactive] Inspecting values needs improvement,True,Area-Interactive#Interactive-ScriptingIDE#Language-C#,https://api.github.com/repos/dotnet/roslyn/issues/5858
dotnet,roslyn,5856,none,2.0 (Preview 5),CSI/VBI: apply /loadpaths to arguments specified on the command line,True,Area-Interactive#Interactive-ScriptingLogic,https://api.github.com/repos/dotnet/roslyn/issues/5856
dotnet,roslyn,5855,none,2.0 (Preview 5),Remove InternalsVisibleTo(Scripting) from compilers,True,Area-Interactive#Interactive-ScriptingLogic,https://api.github.com/repos/dotnet/roslyn/issues/5855
dotnet,roslyn,5825,cston,2.0 (Preview 5),Static script variable initializers should be executed in Script..cctor,True,Area-Interactive#Interactive-ScriptingLogic,https://api.github.com/repos/dotnet/roslyn/issues/5825
dotnet,roslyn,5793,Pilchie,2.0 (Preview 5),Formatting adds additional new line trivia to a pragma suppression fix,True,Area-IDE#Bug,https://api.github.com/repos/dotnet/roslyn/issues/5793
dotnet,roslyn,5783,KevinH-MS,2.0 (Preview 5),VB expression evaluator treats statements with "Dim" as fields,True,Area-Interactive#Interactive-Debugging,https://api.github.com/repos/dotnet/roslyn/issues/5783
dotnet,roslyn,5778,none,2.0 (Preview 5),GenerateDefaultConstructors refactoring is disabled in REPL,True,Area-Interactive#Interactive-ScriptingIDE,https://api.github.com/repos/dotnet/roslyn/issues/5778
dotnet,roslyn,5777,none,2.0 (Preview 5),GenerateMember code fix is disabled in REPL,True,Area-Interactive#Interactive-ScriptingIDE,https://api.github.com/repos/dotnet/roslyn/issues/5777
dotnet,roslyn,5729,none,2.0 (Preview 5),Cannot "Open With" CSharp editor if the file is opened in a different editor,True,Area-IDE#Bug,https://api.github.com/repos/dotnet/roslyn/issues/5729
dotnet,roslyn,5687,CyrusNajmabadi,2.0 (Preview 5),Make FixAllCodeActionContext.FixAllDiagnosticProvider public,True,Area-IDE#Concept-API,https://api.github.com/repos/dotnet/roslyn/issues/5687
dotnet,roslyn,5668,balajikris,2.0 (Preview 5),[LOC] Roslyn.Services.UnitTests.dll has extra assert failure for JPN,True,Area-IDE#Bug#Tenet-Localization,https://api.github.com/repos/dotnet/roslyn/issues/5668
dotnet,roslyn,5661,none,2.0 (Preview 5),Rationalize ObjectFormatter  GacFileResolver and RuntimeReferenceResolver and make them public,True,Area-Interactive#Interactive-ScriptingLogic,https://api.github.com/repos/dotnet/roslyn/issues/5661
dotnet,roslyn,5654,drognanar,2.0 (Preview 5),Implement #r "nuget:...",True,Area-Interactive#Interactive-ScriptingLogic,https://api.github.com/repos/dotnet/roslyn/issues/5654
dotnet,roslyn,5651,genlu,2.0 (Preview 5),Enable clipboard ring rotation (CTRL+SHIFT+V) in interactive window,True,Area-Interactive#Feature Request#Interactive-ScriptingIDE,https://api.github.com/repos/dotnet/roslyn/issues/5651
dotnet,roslyn,5633,KevinH-MS,2.0 (Preview 5),Implement infrastructure for testing InteractiveWorkspace and EditorFeatures,True,Area-Interactive#Interactive-ScriptingIDE#Test,https://api.github.com/repos/dotnet/roslyn/issues/5633
dotnet,roslyn,5620,none,2.0 (Preview 5),Consider addressing possible conflicts introduced by 'replace method with property'.,True,Area-IDE#Feature Request,https://api.github.com/repos/dotnet/roslyn/issues/5620
dotnet,roslyn,5595,rchande,2.0 (Preview 5),Make InlineRenameService.StartInlineSession more asynchronous,True,Area-IDE#Feature Request#Tenet-Performance,https://api.github.com/repos/dotnet/roslyn/issues/5595
dotnet,roslyn,5578,kuhlenh,2.0 (Preview 5),Improve editor right-click context menu usability & footprint,True,Area-IDE#Feature Request,https://api.github.com/repos/dotnet/roslyn/issues/5578
dotnet,roslyn,5574,dpoeschl,2.0 (Preview 5),propdp snippet should use "nameof",True,Area-IDE,https://api.github.com/repos/dotnet/roslyn/issues/5574
dotnet,roslyn,5557,balajikris,2.0 (Preview 5),Roslyn.Services.UnitTests.dll has a failure in Standalone runs,True,Area-IDE#Test,https://api.github.com/repos/dotnet/roslyn/issues/5557
dotnet,roslyn,5555,rchande,2.0 (Preview 5),Roslyn.Services.Editor.VisualBasic.UnitTests.dll fail in Standalone Run,True,Area-IDE#Test,https://api.github.com/repos/dotnet/roslyn/issues/5555
dotnet,roslyn,5533,drognanar,2.0 (Preview 5),#r "nuget:..." should report failures,True,Area-Interactive#Bug#Interactive-ScriptingLogic,https://api.github.com/repos/dotnet/roslyn/issues/5533
dotnet,roslyn,5517,tmat,2.0 (Preview 5),Reference managers are (almost) never shared across submissions,True,Area-Interactive#Feature Request#Interactive-ScriptingLogic,https://api.github.com/repos/dotnet/roslyn/issues/5517
dotnet,roslyn,5501,tmat,2.0 (Preview 5),[Scripting] Suppress CS1701 by default,True,Area-Interactive#Interactive-ScriptingLogic,https://api.github.com/repos/dotnet/roslyn/issues/5501
dotnet,roslyn,5485,none,2.0 (Preview 5),Imports.FromGlobalUsings does not support generic types,True,Area-Interactive#Bug#Interactive-ScriptingLogic,https://api.github.com/repos/dotnet/roslyn/issues/5485
dotnet,roslyn,5464,mattwar,2.0 (Preview 5),Creating compilations for projects with 'ReferenceOutputAssembly' fails,True,Area-IDE#Bug#Concept-API#Resolution-Not Reproducible,https://api.github.com/repos/dotnet/roslyn/issues/5464
dotnet,roslyn,5455,KevinH-MS,2.0 (Preview 5),Bad FullName for dynamic view members,True,Area-Interactive#Bug#Interactive-Debugging,https://api.github.com/repos/dotnet/roslyn/issues/5455
dotnet,roslyn,5397,nguerrera,2.0 (Preview 5),Feature request - Embed source in PDB,True,3 - Working#Area-Compilers#Feature Request#Interactive-Debugging,https://api.github.com/repos/dotnet/roslyn/issues/5397
dotnet,roslyn,5389,jasonmalinowski,2.0 (Preview 5),MSBuildWorkspace fails to load metadatareferences for a project with a non-existent default configuration,True,Area-IDE#Bug,https://api.github.com/repos/dotnet/roslyn/issues/5389
dotnet,roslyn,5384,CyrusNajmabadi,2.0 (Preview 5),Feature request to improve the light bulb experience when multiple issues present in a line of code,True,Area-IDE#Feature Request,https://api.github.com/repos/dotnet/roslyn/issues/5384
dotnet,roslyn,5373,rchande,2.0 (Preview 5),Enum completion prevention of "Color Color" ambiguity,True,Area-IDE#Bug,https://api.github.com/repos/dotnet/roslyn/issues/5373
dotnet,roslyn,5343,dpoeschl,2.0 (Preview 5),The project context navigation bar doesn't cause classification to update.,True,Area-IDE#Bug,https://api.github.com/repos/dotnet/roslyn/issues/5343
dotnet,roslyn,5325,KevinH-MS,2.0 (Preview 5),Support editing/building/debugging .csx/.vbx files in VS as part of a miscellaneous files Workspace,True,Area-Interactive#Interactive-ScriptingIDE,https://api.github.com/repos/dotnet/roslyn/issues/5325
dotnet,roslyn,5300,none,2.0 (Preview 5),VB interactive: Enable test CompilationAPITests.ReferenceManagerReuse_WithSyntaxTrees ,True,Area-Interactive#Interactive-ScriptingLogic,https://api.github.com/repos/dotnet/roslyn/issues/5300
dotnet,roslyn,5283,KevinH-MS,2.0 (Preview 5),OptimizationDataFiles should be published/consumed as a nuget,True,Area-Performance#Feature Request#Tenet-Performance,https://api.github.com/repos/dotnet/roslyn/issues/5283
dotnet,roslyn,5281,none,2.0 (Preview 5),Remove the workaround for internal bug 144964,True,Area-Interactive#Bug#Interactive-ScriptingIDE,https://api.github.com/repos/dotnet/roslyn/issues/5281
dotnet,roslyn,5273,tmat,2.0 (Preview 5),Line numbers in csc-generated PDB are incorrect for release builds,True,Area-Interactive#Interactive-Debugging,https://api.github.com/repos/dotnet/roslyn/issues/5273
dotnet,roslyn,5263,KevinH-MS,2.0 (Preview 5),Implement a specialized Workspace for loose .csx file open in VS,True,Area-Interactive#Interactive-ScriptingIDE,https://api.github.com/repos/dotnet/roslyn/issues/5263
dotnet,roslyn,5260,KevinH-MS,2.0 (Preview 5),#load'ed SyntaxTrees do not have Documents...,True,Area-Interactive#Bug#Interactive-ScriptingIDE,https://api.github.com/repos/dotnet/roslyn/issues/5260
dotnet,roslyn,5253,none,2.0 (Preview 5),[REPL] Allow controlling object formatting thru host object properties/methods,True,Area-Interactive#Interactive-ScriptingIDE,https://api.github.com/repos/dotnet/roslyn/issues/5253
dotnet,roslyn,5246,rchande,2.0 (Preview 5),Quick Info doesn't display newly written XML comments,True,Area-IDE#Bug,https://api.github.com/repos/dotnet/roslyn/issues/5246
dotnet,roslyn,5245,none,2.0 (Preview 5),Rename parameters should rename overrides/implementations,True,Area-IDE#Feature Request,https://api.github.com/repos/dotnet/roslyn/issues/5245
dotnet,roslyn,5235,none,2.0 (Preview 5),VB interactive: Implement SyntaxFactory.IsCompleteSubmission,True,Area-Interactive#Interactive-ScriptingIDE,https://api.github.com/repos/dotnet/roslyn/issues/5235
dotnet,roslyn,5222,none,2.0 (Preview 5),Improve Preview Changes experience,True,0 - Backlog#Area-IDE#Feature Request,https://api.github.com/repos/dotnet/roslyn/issues/5222
dotnet,roslyn,5212,genlu,2.0 (Preview 5),Update Copy/Paste behavior in Interactive Window,True,Area-Interactive#Interactive-ScriptingIDE,https://api.github.com/repos/dotnet/roslyn/issues/5212
dotnet,roslyn,5167,tmat,2.0 (Preview 5),CoreCLR: Resolution of FX assemblies,True,Area-Interactive#Interactive-ScriptingLogic,https://api.github.com/repos/dotnet/roslyn/issues/5167
dotnet,roslyn,5149,jmarolf,2.0 (Preview 5),GenerateMethodTests.GenerateConversionTest.TestEquivalenceKey fails on features/local-functions branch,True,Area-IDE#Test,https://api.github.com/repos/dotnet/roslyn/issues/5149
dotnet,roslyn,5039,jasonmalinowski,2.0 (Preview 5),Analyzers run on inappropriate project,True,Area-IDE#Bug,https://api.github.com/repos/dotnet/roslyn/issues/5039
dotnet,roslyn,5013,tmat,2.0 (Preview 5),Missing doc comments in Quick Info,True,Area-Interactive#Bug#Interactive-ScriptingIDE,https://api.github.com/repos/dotnet/roslyn/issues/5013
dotnet,roslyn,5009,jasonmalinowski,2.0 (Preview 5),VS ignores change of extension,True,Area-IDE#Bug,https://api.github.com/repos/dotnet/roslyn/issues/5009
dotnet,roslyn,4998,Pilchie,2.0 (Preview 5),C# adds spaces after ternary operator even if auto-formatting options are unchecked,True,Area-IDE#Bug,https://api.github.com/repos/dotnet/roslyn/issues/4998
